{
  "$schema": "../schemas/policy.schema.json",
  "id": "key-custody",
  "description": "Custodia de claves: la clave vive dentro del sandbox y NO hay salida de red. Una clave privada más una conexión a internet es la receta de un robo de fondos; aquí el camino de salida sencillamente no existe.",
  "enforcement": {
    "mode": "strict",
    "requiredControls": [
      "filesystem",
      "network",
      "processes",
      "memory",
      "capabilities",
      "devices",
      "environment",
      "cpu"
    ]
  },
  "filesystem": {
    "root": "ephemeral",
    "readOnly": [],
    "writable": [
      "/workspace/output"
    ],
    "maxWorkspaceMb": 128,
    "followSymlinks": false
  },
  "network": {
    "mode": "none",
    "hosts": [],
    "dns": "disabled"
  },
  "resources": {
    "cpu": 1.0,
    "memoryMb": 256,
    "processes": 32,
    "timeoutSeconds": 86400,
    "openFiles": 256,
    "outputBytes": 1048576
  },
  "process": {
    "capabilities": [],
    "environment": {
      "LANG": "C.UTF-8",
      "NO_COLOR": "1",
      "PATH": "/usr/local/bin:/usr/bin:/bin",
      "HOME": "/workspace",
      "PYTHONDONTWRITEBYTECODE": "1",
      "PYTHONUNBUFFERED": "1"
    },
    "allowedEnvironment": [
      "SANDBOX_WALLET_KEY"
    ],
    "user": 65534,
    "group": 65534
  },
  "syscalls": {
    "profile": "default",
    "allow": [],
    "deny": []
  },
  "devices": {
    "allow": [
      "null",
      "zero",
      "random",
      "urandom"
    ]
  }
}
