{
  "$schema": "../schemas/policy.schema.json",
  "id": "ai-agent-restricted",
  "description": "Código generado por IA con salida de red restringida a una allowlist: un agente necesita llamar a su API, no a internet entero. La carga corre SIN red: lo único que cruza la frontera es un socket Unix por el que pide destinos, y el proxy del supervisor los compara con esta lista y registra todos los intentos, permitidos y denegados. La salida es una capacidad que hay que usar a propósito — un cliente HTTP corriente no la usa solo. Ver B-04 en docs/IMPLEMENTATION_BACKLOG.md.",
  "enforcement": {
    "mode": "strict",
    "requiredControls": [
      "filesystem",
      "network",
      "processes",
      "memory",
      "timeout",
      "capabilities",
      "environment",
      "output"
    ]
  },
  "filesystem": {
    "root": "ephemeral",
    "readOnly": [
      "/workspace/input"
    ],
    "writable": [
      "/workspace/output"
    ],
    "maxWorkspaceMb": 256,
    "followSymlinks": false
  },
  "network": {
    "mode": "allowlist",
    "hosts": [
      "api.anthropic.com"
    ],
    "dns": "system"
  },
  "resources": {
    "cpu": 1,
    "memoryMb": 512,
    "processes": 40,
    "timeoutSeconds": 86400,
    "openFiles": 128,
    "outputBytes": 262144
  },
  "process": {
    "capabilities": [],
    "environment": {
      "LANG": "C.UTF-8",
      "NO_COLOR": "1",
      "PATH": "/usr/local/bin:/usr/bin:/bin",
      "HOME": "/workspace"
    },
    "allowedEnvironment": [
      "SANDBOX_AI_API_KEY",
      "SANDBOX_AI_ENDPOINT",
      "SANDBOX_EGRESS_ALLOWLIST"
    ],
    "user": 65534,
    "group": 65534
  },
  "syscalls": {
    "profile": "default",
    "allow": [],
    "deny": []
  },
  "devices": {
    "allow": [
      "null",
      "zero",
      "random",
      "urandom"
    ]
  }
}
